{
  "schemaVersion": 1,
  "id": "official.page.explain-selection",
  "version": "1.0.0",
  "kind": "script",
  "scope": "page",
  "displayName": "Explain Selection",
  "description": "Adds a selection action that sends the highlighted text into Cerebr with an explanation prompt.",
  "publisher": "Cerebr Team",
  "homepage": "https://github.com/yym68686/Cerebr",
  "defaultEnabled": true,
  "requiresExtension": true,
  "permissions": ["page:selection", "shell:input"],
  "compatibility": {
    "versionRange": ">=2.4.66 <3.0.0"
  },
  "script": {
    "entry": "./page.js"
  }
}
