{
  "schemaVersion": 1,
  "id": "local.explain-selection",
  "version": "1.0.0",
  "kind": "script",
  "scope": "page",
  "displayName": "Explain Selection",
  "description": "Show a local developer action next to selected text and send an explanation prompt into Cerebr.",
  "defaultEnabled": true,
  "requiresExtension": true,
  "permissions": ["page:selection", "shell:input"],
  "compatibility": {
    "versionRange": ">=2.4.66 <3.0.0"
  },
  "script": {
    "entry": "./page.js"
  }
}
